<?xml version="1.0" encoding="UTF-8"?>
<xs:schema xmlns:xs="http://www.w3.org/2001/XMLSchema" elementFormDefault="qualified"
    targetNamespace="http://ftn.uns.ac.rs/notification" xmlns:nt="http://ftn.uns.ac.rs/notification">

    <xs:element name="notification">
        <xs:complexType>
            <xs:sequence>
                <xs:element name="sender" type="nt:TParticipant"/>
                <xs:element name="reciever" type="nt:TParticipant"/>
                <xs:element name="publicationName" type="xs:string"/>
                <xs:element name="notificationType" type="nt:TNotificationType"/>
                <xs:element name="content" type="xs:string"/>
            </xs:sequence>
            <xs:attribute name="date" type="xs:date"/>
        </xs:complexType>
    </xs:element>
    <xs:simpleType name="TNotificationType">
        <xs:restriction base="xs:string">
            <xs:enumeration value="publication submitted"/>
            <xs:enumeration value="publication withdrew"/>
            <xs:enumeration value="review assigned"/>
            <xs:enumeration value="review submitted"/>
            <xs:enumeration value="publication accepted"/>
            <xs:enumeration value="publication rejected"/>
            <xs:enumeration value="revision requested"/>
            <xs:enumeration value="revision submitted"/>
        </xs:restriction>
    </xs:simpleType>
    <xs:complexType name="TParticipant">
        <xs:sequence>
            <xs:element name="name" type="xs:string"/>
            <xs:element name="role">
                <xs:simpleType>
                    <xs:restriction base="xs:string">
                        <xs:enumeration value="author"/>
                        <xs:enumeration value="reviewer"/>
                        <xs:enumeration value="editor"/>
                    </xs:restriction>
                </xs:simpleType>
            </xs:element>
            <xs:element name="email">
                <xs:simpleType>
                    <xs:restriction base="xs:string">
                        <xs:pattern value="[^@]+@[^\.]+\..+"/>
                    </xs:restriction>
                </xs:simpleType>
            </xs:element>
        </xs:sequence>
    </xs:complexType>
</xs:schema>
